{
  "schema_version": "1.0.0",
  "harness": "claude",
  "session_id": "68e218377655ad54012bf095f9f24c9a8236ff69bbe269cdfe7592bdddd0680c",
  "timestamp": "2026-09-15T02:14:07Z",
  "observed_at": "2026-09-15T02:14:09Z",
  "tenant_id": "tenant-controlplane",
  "agent_id": "agent-host-sensor-01",
  "host_id": "host-ajm-workstation",
  "process": {
    "pid": 1234,
    "ppid": 1,
    "comm": "claude",
    "rss_bytes": 104857600,
    "cpu_ticks": 450
  },
  "kanban": {
    "task_id": "SLCD-P1-3",
    "shortcode": "SLCD",
    "role": "implementation",
    "elapsed_s": 120
  },
  "metrics": {
    "step_count": 14,
    "tokens_in": 125000,
    "tokens_out": 4200,
    "tool_counts": {
      "view_file": 8,
      "write_to_file": 2,
      "replace_file_content": 3,
      "run_command": 6,
      "grep_search": 4,
      "find_by_name": 1,
      "list_dir": 0,
      "read_url_content": 0,
      "search_web": 0,
      "invoke_subagent": 2,
      "send_message": 0,
      "manage_task": 0,
      "ask_question": 0,
      "other_count": 5
    }
  },
  "network": {
    "inference_endpoint": "api.anthropic.com",
    "egress_bytes": 45000
  }
}
