{"harness":"antigravity","kanban":{"elapsed_s":2941,"role":"preflight","shortcode":"SLCD","task_id":"SLCD-P1-PRE"},"metrics":{"step_count":63,"tokens_in":1840221,"tokens_out":58117,"tool_counts":{"ask_question":0,"find_by_name":14,"grep_search":22,"invoke_subagent":0,"list_dir":6,"manage_task":1,"other_count":12,"read_url_content":0,"replace_file_content":9,"run_command":77,"search_web":0,"send_message":0,"view_file":41,"write_to_file":3}},"network":{"egress_bytes":2211840,"inference_endpoint":"generativelanguage.googleapis.com"},"process":{"comm":"agy","cpu_ticks":7180,"pid":884213,"ppid":3312,"rss_bytes":391720960},"schema_version":"1.0.0","session_id":"bf5e6b2c8ce9fca92c54885d07818c8bd87892253d4ed4b75b03379c09937b90","timestamp":"2026-09-15T02:31:44.512Z"}