{"agent_id":"agent-host-sensor-01","harness":"claude","host_id":"host-ajm-workstation","kanban":{"elapsed_s":120,"role":"implementation","shortcode":"SLCD","task_id":"SLCD-P1-3"},"metrics":{"step_count":14,"tokens_in":125000,"tokens_out":4200,"tool_counts":{"ask_question":0,"find_by_name":1,"grep_search":4,"invoke_subagent":2,"list_dir":0,"manage_task":0,"other_count":5,"read_url_content":0,"replace_file_content":3,"run_command":6,"search_web":0,"send_message":0,"view_file":8,"write_to_file":2}},"network":{"egress_bytes":45000,"inference_endpoint":"api.anthropic.com"},"observed_at":"2026-09-15T02:14:09Z","process":{"comm":"claude","cpu_ticks":450,"pid":1234,"ppid":1,"rss_bytes":104857600},"schema_version":"1.0.0","session_id":"68e218377655ad54012bf095f9f24c9a8236ff69bbe269cdfe7592bdddd0680c","tenant_id":"tenant-controlplane","timestamp":"2026-09-15T02:14:07Z"}